<!--
 
 LA-CC 05-135 Trident 0.7.1

Copyright Notice
Copyright 2006 (c) the Regents of the University of California.

This Software was produced under a U.S. Government contract
(W-7405-ENG-36) by Los Alamos National Laboratory, which is operated
by the University of California for the U.S. Department of Energy. The
U.S. Government is licensed to use, reproduce, and distribute this
Software. Permission is granted to the public to copy and use this
Software without charge, provided that this Notice and any statement
of authorship are reproduced on all copies. Neither the Government nor
the University makes any warranty, express or implied, or assumes any
liability or responsibility for the user of this Software.


-->


<?xml version='1.0' standalone="no"?>

<!DOCTYPE hardware SYSTEM "hw.dtd">

<hardware>
 <name>osiris</name>
 <chip type="fpga">
  <name>Xilinx_Virtex-II_6000</name>
  <area_max_usage>.9</area_max_usage>
  <area_min_usage>.2</area_min_usage>
  <area>33792</area>

  <resource type="blockram">
   <count>144</count>
   <size>18432</size>
  </resource>
 
  <resource type="multiplier">
    <count>144</count>
    <dimension1>18</dimension1>
    <dimension2>18</dimension2>
  </resource>

 </chip>

 <!-- ZBT SRAM --> 
 <chip type="ram">
  <count>10</count>
  <name>zbt_sram</name>
  <word_size>32</word_size>
  <size>4288</size>  <!-- supposed to be 524288 -->

  <port type="address_rw">
   <count> 1 </count>
   <clock>1</clock>
  </port>

  <port type="data_read">
   <count>1</count>
   <size>32</size>
   <read_latency>5</read_latency>
   <clock>1</clock>
  </port>

  <port type="data_write">
   <count>1</count>
   <size>32</size>
   <write_latency>1</write_latency>
   <clock>1</clock>
  </port>

 </chip>

 <!-- SDRAM --> 
 <chip type="ram">
  <count>1</count>
  <name>sdram</name>
  <word_size>64</word_size>
  <size>67108864</size>

  <port type="address_rw">
   <count> 1 </count>
   <clock>1</clock>
  </port>
  
  <port type="data_read">
   <count>1</count>
   <size>64</size>
   <read_latency>5</read_latency>
   <clock>1</clock>
  </port>

  <port type="data_write">
   <count>1</count>
   <size>64</size>
   <write_latency>1</write_latency>
   <clock>1</clock>
  </port>

 </chip>

</hardware>
